{
  "$schema": "./schema-modelo.json",
  "id": "controlador-pid",
  "version": "1.0",
  "nombre": "Sintonizador PID (Control Automático)",
  "descripcion": "Optimiza las ganancias Proporcional (Kp), Integral (Ki) y Derivativa (Kd) para controlar una planta dinámica minimizando sobrepico y tiempo de respuesta.",
  "categoria": "Control y Automatización",
  "dificultad": "Principiante",
  "tags": [
    "pid",
    "control",
    "automatización",
    "estabilidad",
    "sobreimpulso"
  ],
  "tipoVisualizacion": "controlador_pid",
  "variables": [
    {
      "nombre": "Kp",
      "etiqueta": "Kp: Ganancia proporcional del lazo",
      "tipo": "continuo",
      "min": 0.1,
      "max": 35
    },
    {
      "nombre": "Ki",
      "etiqueta": "Ki: Ganancia integral (eliminación de error de estado estacionario)",
      "tipo": "continuo",
      "min": 0,
      "max": 25
    },
    {
      "nombre": "Kd",
      "etiqueta": "Kd: Ganancia derivativa (amortiguamiento transitorio)",
      "tipo": "continuo",
      "min": 0,
      "max": 10
    }
  ],
  "codigoEvaluacion": "const { Kp, Ki, Kd } = vars;\n// Parámetros de la planta por defecto\nconst wn = 2.5, zeta = 0.4;\nconst dt = 0.01, tiempoTotal = 8.0;\nconst N = Math.round(tiempoTotal / dt);\n\nlet y = 0.0, yd = 0.0;\nlet integralError = 0.0, errorPrevio = 1.0;\nlet yMax = 0.0, itae = 0.0;\nconst ts = []; // historial (t, y) para el tiempo de establecimiento\n\nfor (let k = 1; k <= N; k++) {\n  const t = k * dt;\n  const e = 1.0 - y; // escalón unitario de referencia\n\n  // Integral con anti-windup y derivada discreta\n  integralError = Math.max(-50, Math.min(50, integralError + e * dt));\n  const de = (e - errorPrevio) / dt;\n  errorPrevio = e;\n\n  // Ley PID con saturación del actuador en [-80, 80]\n  let u = Kp * e + Ki * integralError + Kd * de;\n  u = Math.max(-80, Math.min(80, u));\n\n  // Planta de 2do orden integrada con Euler semi-implícito\n  const ydd = (wn * wn * u) - (2.0 * zeta * wn * yd) - (wn * wn * y);\n  yd += ydd * dt;\n  y += yd * dt;\n\n  // Divergencia: se corta la simulación\n  if (isNaN(y) || Math.abs(y) > 100) { y = 100; break; }\n\n  if (y > yMax) yMax = y;\n  itae += t * Math.abs(e) * dt;\n  ts.push({ t, y });\n}\n\n// Sobrepico porcentual\nconst sobrepicoPct = Math.max(0, (yMax - 1.0) * 100);\n\n// Tiempo de establecimiento al 2% (el punto inicial t=0 tiene y=0)\nlet tEstablecimiento = tiempoTotal;\nfor (let i = ts.length; i >= 0; i--) {\n  const p = i === 0 ? { t: 0, y: 0 } : ts[i - 1];\n  if (Math.abs(p.y - 1.0) > 0.02) {\n    tEstablecimiento = Math.min(tiempoTotal, p.t + dt);\n    break;\n  }\n}\n\n// Sistema inestable: penalización fija\nconst esEstable = !isNaN(y) && Math.abs(y - 1.0) < 0.15 && yMax < 3.0;\nif (!esEstable) return [500, 500];\nreturn [sobrepicoPct, tEstablecimiento];",
  "grafo": {
    "nodos": [
      {
        "id": "sumador",
        "nombre": "Sumador Error e(t)",
        "x": -40,
        "y": 0,
        "tipo": "fijo",
        "anguloGuia": 0,
        "masa": 1,
        "carga": 0,
        "cargaElectrica": 0,
        "imanDipolo": 0,
        "temperaturaFuente": 0,
        "variableX": null,
        "variableY": null,
        "variableIman": null,
        "variableCarga": null,
        "variableTemp": null,
        "offsetX": 0,
        "offsetY": 0,
        "escalaX": 1,
        "escalaY": 1
      },
      {
        "id": "rama_p",
        "nombre": "Rama Proporcional (Kp)",
        "x": 0,
        "y": 22,
        "tipo": "libre",
        "anguloGuia": 0,
        "masa": 1,
        "carga": 0,
        "cargaElectrica": 0,
        "imanDipolo": 0,
        "temperaturaFuente": 0,
        "variableX": null,
        "variableY": "Kp",
        "variableIman": null,
        "variableCarga": null,
        "variableTemp": null,
        "signoY": 1,
        "offsetX": 0,
        "offsetY": 10,
        "escalaX": 1,
        "escalaY": 1
      },
      {
        "id": "rama_i",
        "nombre": "Rama Integral (Ki)",
        "x": 0,
        "y": 3.2,
        "tipo": "libre",
        "anguloGuia": 0,
        "masa": 1,
        "carga": 0,
        "cargaElectrica": 0,
        "imanDipolo": 0,
        "temperaturaFuente": 0,
        "variableX": null,
        "variableY": "Ki",
        "variableIman": null,
        "variableCarga": null,
        "variableTemp": null,
        "signoY": 1,
        "offsetX": 0,
        "offsetY": 0,
        "escalaX": 1,
        "escalaY": 0.4
      },
      {
        "id": "rama_d",
        "nombre": "Rama Derivativa (Kd)",
        "x": 0,
        "y": -16,
        "tipo": "libre",
        "anguloGuia": 0,
        "masa": 1,
        "carga": 0,
        "cargaElectrica": 0,
        "imanDipolo": 0,
        "temperaturaFuente": 0,
        "variableX": null,
        "variableY": "Kd",
        "variableIman": null,
        "variableCarga": null,
        "variableTemp": null,
        "signoY": -1,
        "offsetX": 0,
        "offsetY": -10,
        "escalaX": 1,
        "escalaY": 2
      },
      {
        "id": "planta",
        "nombre": "Planta 2do Orden y(t)",
        "x": 40,
        "y": 0,
        "tipo": "fijo",
        "anguloGuia": 0,
        "masa": 1,
        "carga": 0,
        "cargaElectrica": 0,
        "imanDipolo": 0,
        "temperaturaFuente": 0,
        "variableX": null,
        "variableY": null,
        "variableIman": null,
        "variableCarga": null,
        "variableTemp": null,
        "offsetX": 0,
        "offsetY": 0,
        "escalaX": 1,
        "escalaY": 1
      }
    ],
    "barras": [
      {
        "id": "in_rama_p",
        "nombre": "Entrada RAMA_P",
        "nodoA": "sumador",
        "nodoB": "rama_p",
        "longitud": 42,
        "variableAsociada": null,
        "signoTrilateracion": 1,
        "color": "#3b82f6",
        "grosor": 2.5,
        "esAuxiliar": false
      },
      {
        "id": "out_rama_p",
        "nombre": "Acción RAMA_P",
        "nodoA": "rama_p",
        "nodoB": "planta",
        "longitud": 42,
        "variableAsociada": null,
        "signoTrilateracion": 1,
        "color": "#3b82f6",
        "grosor": 2.5,
        "esAuxiliar": false
      },
      {
        "id": "in_rama_i",
        "nombre": "Entrada RAMA_I",
        "nodoA": "sumador",
        "nodoB": "rama_i",
        "longitud": 42,
        "variableAsociada": null,
        "signoTrilateracion": 1,
        "color": "#10b981",
        "grosor": 2.5,
        "esAuxiliar": false
      },
      {
        "id": "out_rama_i",
        "nombre": "Acción RAMA_I",
        "nodoA": "rama_i",
        "nodoB": "planta",
        "longitud": 42,
        "variableAsociada": null,
        "signoTrilateracion": 1,
        "color": "#10b981",
        "grosor": 2.5,
        "esAuxiliar": false
      },
      {
        "id": "in_rama_d",
        "nombre": "Entrada RAMA_D",
        "nodoA": "sumador",
        "nodoB": "rama_d",
        "longitud": 42,
        "variableAsociada": null,
        "signoTrilateracion": 1,
        "color": "#f59e0b",
        "grosor": 2.5,
        "esAuxiliar": false
      },
      {
        "id": "out_rama_d",
        "nombre": "Acción RAMA_D",
        "nodoA": "rama_d",
        "nodoB": "planta",
        "longitud": 42,
        "variableAsociada": null,
        "signoTrilateracion": 1,
        "color": "#f59e0b",
        "grosor": 2.5,
        "esAuxiliar": false
      }
    ],
    "cuerposRigidos": [],
    "motores": [],
    "transmisiones": [],
    "sensores": [
      {
        "id": "sensor_pid",
        "nombre": "salida_y",
        "nodoId": "planta",
        "magnitudes": [
          "posicion"
        ],
        "color": "#10b981"
      }
    ],
    "capasFisicas": []
  }
}
