{
  "$schema": "./schema-modelo.json",
  "id": "campo-potencial",
  "version": "1.0",
  "nombre": "Campo de Potencial y Deflexión 2D",
  "descripcion": "Optimiza la ubicación y polaridad de electrodos deflectores para guiar partículas a través de un campo de potencial V(x,y) evitando barreras de sobrepotencial.",
  "categoria": "Electromagnetismo y Campos",
  "dificultad": "Intermedio",
  "tags": [
    "campo eléctrico",
    "potencial",
    "gradiente",
    "trayectoria de partículas"
  ],
  "tipoVisualizacion": "campo_potencial_2d",
  "variables": [
    {
      "nombre": "x1",
      "etiqueta": "x1: Electrodo 1 X (mm)",
      "tipo": "continuo",
      "min": -35,
      "max": 35
    },
    {
      "nombre": "y1",
      "etiqueta": "y1: Electrodo 1 Y (mm)",
      "tipo": "continuo",
      "min": -30,
      "max": 30
    },
    {
      "nombre": "q1",
      "etiqueta": "q1: Electrodo 1 carga (polaridad y magnitud)",
      "tipo": "continuo",
      "min": -3,
      "max": 3
    },
    {
      "nombre": "x2",
      "etiqueta": "x2: Electrodo 2 X (mm)",
      "tipo": "continuo",
      "min": -35,
      "max": 35
    },
    {
      "nombre": "y2",
      "etiqueta": "y2: Electrodo 2 Y (mm)",
      "tipo": "continuo",
      "min": -30,
      "max": 30
    },
    {
      "nombre": "q2",
      "etiqueta": "q2: Electrodo 2 carga (polaridad y magnitud)",
      "tipo": "continuo",
      "min": -3,
      "max": 3
    }
  ],
  "codigoEvaluacion": "// Parámetros por defecto del haz\nconst emisorX = -45, emisorY = 0, colectorX = 45, colectorY = 0;\nconst vInicial = 14.0, cargaParticula = 1.0;\n\nconst electrodos = [\n  { x: vars.x1, y: vars.y1, q: vars.q1 },\n  { x: vars.x2, y: vars.y2, q: vars.q2 }\n];\n// Barrera central repulsora, emisor y colector atractor\nconst cargasFijas = [\n  { x: 0, y: 0, q: 1.8 },\n  { x: emisorX, y: emisorY, q: 0.5 },\n  { x: colectorX, y: colectorY, q: -1.2 }\n];\n\n// Potencial en (x, y) con suavizado para evitar la singularidad en r = 0\nconst potencial = (x, y) => {\n  const eps = 1.5;\n  let v = 0;\n  for (const c of cargasFijas) v += (c.q * 100) / Math.sqrt(Math.hypot(x - c.x, y - c.y) ** 2 + eps * eps);\n  for (const e of electrodos) v += (e.q * 100) / Math.sqrt(Math.hypot(x - e.x, y - e.y) ** 2 + eps * eps);\n  return v;\n};\n// Campo E = -grad V por diferencias centradas\nconst campo = (x, y) => {\n  const h = 0.5;\n  return {\n    ex: -(potencial(x + h, y) - potencial(x - h, y)) / (2 * h),\n    ey: -(potencial(x, y + h) - potencial(x, y - h)) / (2 * h)\n  };\n};\n\n// Integración de la trayectoria de la partícula (Euler semi-implícito)\nlet x = emisorX, y = emisorY, vx = vInicial, vy = 0.0;\nconst dt = 0.05, masa = 1.0;\nlet distanciaMinimaColector = Infinity, energiaCinematicaTotal = 0, colisionObstaculo = false;\n\nfor (let paso = 0; paso < 200; paso++) {\n  const distColector = Math.hypot(x - colectorX, y - colectorY);\n  if (distColector < distanciaMinimaColector) distanciaMinimaColector = distColector;\n  if (Math.hypot(x, y) < 6.0) colisionObstaculo = true;\n  if (distColector < 3.5) break;\n\n  const { ex, ey } = campo(x, y);\n  vx += (cargaParticula * ex / masa) * dt;\n  vy += (cargaParticula * ey / masa) * dt;\n  x += vx * dt;\n  y += vy * dt;\n  energiaCinematicaTotal += 0.5 * masa * (vx * vx + vy * vy) * dt;\n  if (Math.abs(x) > 65 || Math.abs(y) > 45) break;\n}\n\n// Penalización por chocar con la barrera central\nconst penalizacionColision = colisionObstaculo ? 250 : 0;\nconst objDistancia = distanciaMinimaColector + penalizacionColision;\nconst esfuerzoCargas = Math.abs(vars.q1) + Math.abs(vars.q2);\nconst objEnergia = (energiaCinematicaTotal * 0.05) + (esfuerzoCargas * 2.0) + (penalizacionColision > 0 ? 5.0 : 0);\n\n// Frente de Pareto: distancia al colector vs. energía de campo\nreturn [objDistancia, objEnergia];",
  "grafo": {
    "nodos": [
      {
        "id": "emisor",
        "nombre": "Emisor (-45,0)",
        "x": -45,
        "y": 0,
        "tipo": "fijo",
        "anguloGuia": 0,
        "masa": 1,
        "carga": 0.5,
        "cargaElectrica": 0.5,
        "imanDipolo": 0,
        "temperaturaFuente": 0,
        "variableX": null,
        "variableY": null,
        "variableIman": null,
        "variableCarga": null,
        "variableTemp": null,
        "offsetX": 0,
        "offsetY": 0,
        "escalaX": 1,
        "escalaY": 1
      },
      {
        "id": "barrera",
        "nombre": "Barrera Central (0,0)",
        "x": 0,
        "y": 0,
        "tipo": "fijo",
        "anguloGuia": 0,
        "masa": 1,
        "carga": 1.8,
        "cargaElectrica": 1.8,
        "imanDipolo": 0,
        "temperaturaFuente": 0,
        "variableX": null,
        "variableY": null,
        "variableIman": null,
        "variableCarga": null,
        "variableTemp": null,
        "offsetX": 0,
        "offsetY": 0,
        "escalaX": 1,
        "escalaY": 1
      },
      {
        "id": "colector",
        "nombre": "Colector (45,0)",
        "x": 45,
        "y": 0,
        "tipo": "fijo",
        "anguloGuia": 0,
        "masa": 1,
        "carga": -1.2,
        "cargaElectrica": -1.2,
        "imanDipolo": 0,
        "temperaturaFuente": 0,
        "variableX": null,
        "variableY": null,
        "variableIman": null,
        "variableCarga": null,
        "variableTemp": null,
        "offsetX": 0,
        "offsetY": 0,
        "escalaX": 1,
        "escalaY": 1
      },
      {
        "id": "electrodo1",
        "nombre": "Electrodo 1 (x1, y1)",
        "x": -12,
        "y": 14,
        "tipo": "libre",
        "anguloGuia": 0,
        "masa": 1,
        "carga": 2,
        "cargaElectrica": 2,
        "imanDipolo": 0,
        "temperaturaFuente": 0,
        "variableX": "x1",
        "variableY": "y1",
        "variableIman": null,
        "variableCarga": null,
        "variableTemp": null,
        "offsetX": 0,
        "offsetY": 0,
        "escalaX": 1,
        "escalaY": 1
      },
      {
        "id": "electrodo2",
        "nombre": "Electrodo 2 (x2, y2)",
        "x": 14,
        "y": -14,
        "tipo": "libre",
        "anguloGuia": 0,
        "masa": 1,
        "carga": -2,
        "cargaElectrica": -2,
        "imanDipolo": 0,
        "temperaturaFuente": 0,
        "variableX": "x2",
        "variableY": "y2",
        "variableIman": null,
        "variableCarga": null,
        "variableTemp": null,
        "offsetX": 0,
        "offsetY": 0,
        "escalaX": 1,
        "escalaY": 1
      }
    ],
    "barras": [
      {
        "id": "tray_1",
        "nombre": "Deflexión Entrada",
        "nodoA": "emisor",
        "nodoB": "electrodo1",
        "longitud": 35,
        "variableAsociada": null,
        "signoTrilateracion": 1,
        "color": "#38bdf8",
        "grosor": 2.5,
        "esAuxiliar": false
      },
      {
        "id": "tray_2",
        "nombre": "Acoplamiento Dipolar",
        "nodoA": "electrodo1",
        "nodoB": "electrodo2",
        "longitud": 38,
        "variableAsociada": null,
        "signoTrilateracion": 1,
        "color": "#f59e0b",
        "grosor": 2.5,
        "esAuxiliar": false
      },
      {
        "id": "tray_3",
        "nombre": "Enfoque a Colector",
        "nodoA": "electrodo2",
        "nodoB": "colector",
        "longitud": 34,
        "variableAsociada": null,
        "signoTrilateracion": 1,
        "color": "#10b981",
        "grosor": 2.5,
        "esAuxiliar": false
      }
    ],
    "cuerposRigidos": [],
    "motores": [],
    "transmisiones": [],
    "sensores": [
      {
        "id": "sensor_potencial",
        "nombre": "particula",
        "nodoId": "electrodo1",
        "magnitudes": [
          "posicion",
          "campo_e",
          "trayectoria"
        ],
        "color": "#38bdf8"
      }
    ],
    "capasFisicas": []
  }
}
