{
  "$schema": "./schema-modelo.json",
  "id": "cohete-landing",
  "version": "1.0",
  "nombre": "Aterrizaje de Cohete (Falcon Landing)",
  "descripcion": "Control de empuje vectorial de un cohete en descenso retro-propulsado para tocar una plataforma marina con velocidad nula minimizando combustible.",
  "categoria": "Aeroespacial y Balística",
  "dificultad": "Avanzado",
  "tags": [
    "aeroespacial",
    "cohete",
    "empuje vectorial",
    "gravedad",
    "retropropulsión"
  ],
  "tipoVisualizacion": "cohete_landing",
  "variables": [
    {
      "nombre": "F1",
      "etiqueta": "Empuje fase 1 (N)",
      "tipo": "continuo",
      "min": 0,
      "max": 20000
    },
    {
      "nombre": "F2",
      "etiqueta": "Empuje fase 2 (N)",
      "tipo": "continuo",
      "min": 0,
      "max": 20000
    },
    {
      "nombre": "F3",
      "etiqueta": "Empuje fase 3 (N)",
      "tipo": "continuo",
      "min": 0,
      "max": 20000
    },
    {
      "nombre": "F4",
      "etiqueta": "Empuje fase 4 (N)",
      "tipo": "continuo",
      "min": 0,
      "max": 20000
    },
    {
      "nombre": "A1",
      "etiqueta": "Ángulo fase 1 (°)",
      "tipo": "continuo",
      "min": -15,
      "max": 15
    },
    {
      "nombre": "A2",
      "etiqueta": "Ángulo fase 2 (°)",
      "tipo": "continuo",
      "min": -15,
      "max": 15
    },
    {
      "nombre": "A3",
      "etiqueta": "Ángulo fase 3 (°)",
      "tipo": "continuo",
      "min": -15,
      "max": 15
    },
    {
      "nombre": "A4",
      "etiqueta": "Ángulo fase 4 (°)",
      "tipo": "continuo",
      "min": -15,
      "max": 15
    }
  ],
  "codigoEvaluacion": "// Entorno por defecto del modelo nativo\nconst viento = 4.0;\nconst alturaInicial = 120.0;\nconst fuerzas = [vars.F1, vars.F2, vars.F3, vars.F4];\nconst angulos = [vars.A1, vars.A2, vars.A3, vars.A4];\n\n// Constantes físicas y estado inicial\nconst g = 9.81, dt = 0.05, masaSeca = 500, combInicial = 500;\nconst tasaConsumo = 0.00045;\nlet masa = masaSeca + combInicial;\nlet x = 15.0, y = alturaInicial, vx = -2.0, vy = -22.0;\nlet t = 0;\nconst tiempoFase = 2.0;\nlet ultimo = { x, vx, vy };\n\n// Integración temporal: 4 fases de 2 s, hasta tocar el suelo o 10 s\nwhile (y > 0 && t < 10.0) {\n  const faseIdx = Math.min(3, Math.floor(t / tiempoFase));\n  let empuje = fuerzas[faseIdx];\n  const angRad = (angulos[faseIdx] * Math.PI) / 180;\n\n  // Sin propelente el empuje cesa; si no, se descuenta el consumo\n  const combRestante = masa - masaSeca;\n  if (combRestante <= 0) {\n    empuje = 0;\n  } else {\n    masa -= Math.min(combRestante, empuje * tasaConsumo * dt);\n  }\n\n  // Empuje vectorial y arrastre aerodinámico\n  const fEmpujeX = empuje * Math.sin(angRad);\n  const fEmpujeY = empuje * Math.cos(angRad);\n  const fArrastreX = -0.08 * (vx - viento) * Math.abs(vx - viento);\n  const fArrastreY = -0.06 * vy * Math.abs(vy);\n  const ax = (fEmpujeX + fArrastreX) / masa;\n  const ay = -g + (fEmpujeY + fArrastreY) / masa;\n\n  vx += ax * dt;\n  vy += ay * dt;\n  x += vx * dt;\n  y += vy * dt;\n  t += dt;\n  ultimo = { x, vx, vy };\n}\n\n// Métricas de impacto y consumo\nconst velocidadImpacto = Math.hypot(ultimo.vx, ultimo.vy);\nconst desvioPlataforma = Math.abs(ultimo.x);\nconst combustibleRestante = Math.max(0, masa - masaSeca);\nconst combustibleGastadoPct = ((combInicial - combustibleRestante) / combInicial) * 100;\n\n// Penalizaciones por impacto severo o caída fuera de la barcaza\nlet penalizacionCrash = 0;\nif (velocidadImpacto > 4.0) penalizacionCrash += (velocidadImpacto - 4.0) * 8.0;\nif (desvioPlataforma > 12.0) penalizacionCrash += (desvioPlataforma - 12.0) * 5.0;\n\nconst objVelocidad = velocidadImpacto + desvioPlataforma * 0.4 + penalizacionCrash;\nconst objCombustible = combustibleGastadoPct / 100 + (penalizacionCrash > 0 ? 1.0 : 0);\nreturn [objVelocidad, objCombustible];",
  "grafo": {
    "nodos": [
      {
        "id": "asds_centro",
        "nombre": "Barcaza ASDS (0,0)",
        "x": 0,
        "y": 0,
        "tipo": "fijo",
        "anguloGuia": 0,
        "masa": 1,
        "carga": 0,
        "cargaElectrica": 0,
        "imanDipolo": 0,
        "temperaturaFuente": 0,
        "variableX": null,
        "variableY": null,
        "variableIman": null,
        "variableCarga": null,
        "variableTemp": null,
        "offsetX": 0,
        "offsetY": 0,
        "escalaX": 1,
        "escalaY": 1
      },
      {
        "id": "asds_izq",
        "nombre": "Babor Plataforma",
        "x": -16,
        "y": 0,
        "tipo": "fijo",
        "anguloGuia": 0,
        "masa": 1,
        "carga": 0,
        "cargaElectrica": 0,
        "imanDipolo": 0,
        "temperaturaFuente": 0,
        "variableX": null,
        "variableY": null,
        "variableIman": null,
        "variableCarga": null,
        "variableTemp": null,
        "offsetX": 0,
        "offsetY": 0,
        "escalaX": 1,
        "escalaY": 1
      },
      {
        "id": "asds_der",
        "nombre": "Estribor Plataforma",
        "x": 16,
        "y": 0,
        "tipo": "fijo",
        "anguloGuia": 0,
        "masa": 1,
        "carga": 0,
        "cargaElectrica": 0,
        "imanDipolo": 0,
        "temperaturaFuente": 0,
        "variableX": null,
        "variableY": null,
        "variableIman": null,
        "variableCarga": null,
        "variableTemp": null,
        "offsetX": 0,
        "offsetY": 0,
        "escalaX": 1,
        "escalaY": 1
      },
      {
        "id": "fase4",
        "nombre": "Fase 4: Touchdown (A4, F4)",
        "x": 2,
        "y": 18,
        "tipo": "libre",
        "anguloGuia": 0,
        "masa": 1,
        "carga": 0,
        "cargaElectrica": 0,
        "imanDipolo": 0,
        "temperaturaFuente": 75,
        "variableX": "A4",
        "variableY": "F4",
        "variableIman": null,
        "variableCarga": null,
        "variableTemp": null,
        "signoY": 1,
        "offsetX": 2,
        "offsetY": 0,
        "escalaX": 1,
        "escalaY": 0.0018
      },
      {
        "id": "fase3",
        "nombre": "Fase 3: Frenado (A3, F3)",
        "x": 6,
        "y": 32,
        "tipo": "libre",
        "anguloGuia": 0,
        "masa": 1,
        "carga": 0,
        "cargaElectrica": 0,
        "imanDipolo": 0,
        "temperaturaFuente": 82,
        "variableX": "A3",
        "variableY": "F3",
        "variableIman": null,
        "variableCarga": null,
        "variableTemp": null,
        "signoY": 1,
        "offsetX": 6,
        "offsetY": 0,
        "escalaX": 1,
        "escalaY": 0.0032
      },
      {
        "id": "fase2",
        "nombre": "Fase 2: Descenso (A2, F2)",
        "x": 10,
        "y": 46,
        "tipo": "libre",
        "anguloGuia": 0,
        "masa": 1,
        "carga": 0,
        "cargaElectrica": 0,
        "imanDipolo": 0,
        "temperaturaFuente": 88,
        "variableX": "A2",
        "variableY": "F2",
        "variableIman": null,
        "variableCarga": null,
        "variableTemp": null,
        "signoY": 1,
        "offsetX": 10,
        "offsetY": 0,
        "escalaX": 1,
        "escalaY": 0.0046
      },
      {
        "id": "fase1",
        "nombre": "Fase 1: Entrada (A1, F1)",
        "x": 15,
        "y": 60,
        "tipo": "libre",
        "anguloGuia": 0,
        "masa": 1,
        "carga": 0,
        "cargaElectrica": 0,
        "imanDipolo": 0,
        "temperaturaFuente": 95,
        "variableX": "A1",
        "variableY": "F1",
        "variableIman": null,
        "variableCarga": null,
        "variableTemp": null,
        "signoY": 1,
        "offsetX": 15,
        "offsetY": 0,
        "escalaX": 1,
        "escalaY": 0.006
      }
    ],
    "barras": [
      {
        "id": "cubierta_asds",
        "nombre": "Cubierta Barcaza Marina",
        "nodoA": "asds_izq",
        "nodoB": "asds_der",
        "longitud": 32,
        "variableAsociada": null,
        "signoTrilateracion": 1,
        "color": "#64748b",
        "grosor": 4,
        "esAuxiliar": false
      },
      {
        "id": "tramo_1_2",
        "nombre": "Trayectoria Fase 1→2",
        "nodoA": "fase1",
        "nodoB": "fase2",
        "longitud": 20,
        "variableAsociada": null,
        "signoTrilateracion": 1,
        "color": "#f97316",
        "grosor": 3,
        "esAuxiliar": false
      },
      {
        "id": "tramo_2_3",
        "nombre": "Trayectoria Fase 2→3",
        "nodoA": "fase2",
        "nodoB": "fase3",
        "longitud": 18,
        "variableAsociada": null,
        "signoTrilateracion": 1,
        "color": "#f59e0b",
        "grosor": 3,
        "esAuxiliar": false
      },
      {
        "id": "tramo_3_4",
        "nombre": "Trayectoria Fase 3→4",
        "nodoA": "fase3",
        "nodoB": "fase4",
        "longitud": 16,
        "variableAsociada": null,
        "signoTrilateracion": 1,
        "color": "#eab308",
        "grosor": 3,
        "esAuxiliar": false
      },
      {
        "id": "tramo_touchdown",
        "nombre": "Aproximación Final ASDS",
        "nodoA": "fase4",
        "nodoB": "asds_centro",
        "longitud": 18,
        "variableAsociada": null,
        "signoTrilateracion": 1,
        "color": "#10b981",
        "grosor": 3.2,
        "esAuxiliar": false
      }
    ],
    "cuerposRigidos": [],
    "motores": [],
    "transmisiones": [],
    "sensores": [
      {
        "id": "sensor_cohete",
        "nombre": "tobera",
        "nodoId": "fase4",
        "magnitudes": [
          "posicion",
          "velocidad",
          "aceleracion",
          "temperatura"
        ],
        "color": "#f59e0b"
      }
    ],
    "capasFisicas": []
  }
}
