{
  "$schema": "./schema-modelo.json",
  "id": "pata-caminante",
  "version": "1.0",
  "nombre": "Pata caminante (cuatro barras)",
  "descripcion": "Optimiza un mecanismo de cuatro barras para que el pie describa una marcha con apoyo horizontal plano y retorno elevado.",
  "categoria": "Robótica y Cinemática",
  "dificultad": "Intermedio",
  "tags": [
    "cinemática",
    "cuatro barras",
    "mecanismo",
    "locomoción",
    "zancada"
  ],
  "tipoVisualizacion": "pata_caminante",
  "variables": [
    {
      "nombre": "dx",
      "etiqueta": "dx: Pivote O2 en X",
      "tipo": "continuo",
      "min": -3,
      "max": 3
    },
    {
      "nombre": "dy",
      "etiqueta": "dy: Pivote O2 en Y",
      "tipo": "continuo",
      "min": -3,
      "max": 3
    },
    {
      "nombre": "L",
      "etiqueta": "L: Largo del acoplador",
      "tipo": "continuo",
      "min": 1,
      "max": 6
    },
    {
      "nombre": "r3",
      "etiqueta": "r3: Largo del balancín",
      "tipo": "continuo",
      "min": 1,
      "max": 6
    },
    {
      "nombre": "p",
      "etiqueta": "p: Extensión hacia el pie",
      "tipo": "continuo",
      "min": 0.5,
      "max": 6
    },
    {
      "nombre": "alpha",
      "etiqueta": "alpha: Ángulo del pie (rad)",
      "tipo": "continuo",
      "min": -3.141592653589793,
      "max": 3.141592653589793
    }
  ],
  "codigoEvaluacion": "// Pesos por defecto: planitud, zancada, despeje y uniformidad de velocidad\nconst w1 = 3.0, w2 = 1.0, w3 = 1.0, w4 = 1.0;\nconst { dx, dy, L, r3, p, alpha } = vars;\n\nconst N = 60;\nif (!globalThis._walkPx) {\n  globalThis._walkPx = new Float64Array(60);\n  globalThis._walkPy = new Float64Array(60);\n  globalThis._walkCos = new Float64Array(60);\n  globalThis._walkSin = new Float64Array(60);\n  for (let s = 0; s < 60; s++) {\n    const th = (2 * Math.PI * s) / 60;\n    globalThis._walkCos[s] = Math.cos(th);\n    globalThis._walkSin[s] = Math.sin(th);\n  }\n}\nconst px = globalThis._walkPx;\nconst py = globalThis._walkPy;\nconst cTable = globalThis._walkCos;\nconst sTable = globalThis._walkSin;\n\nconst L2 = L * L, r3_2 = r3 * r3;\nconst L_plus_r3 = L + r3, L_minus_r3 = Math.abs(L - r3);\n\nlet minX = Infinity, maxX = -Infinity, minY = Infinity, maxY = -Infinity;\n\nfor (let s = 0; s < N; s++) {\n  const ax = cTable[s], ay = sTable[s];\n  const vx = dx - ax, vy = dy - ay;\n  const d2 = vx * vx + vy * vy;\n  const d = Math.sqrt(d2);\n  if (d <= 1e-9 || d > L_plus_r3 || d < L_minus_r3) return 1000 + (N - s) * 10;\n  const a = (L2 - r3_2 + d2) / (2 * d);\n  const h2 = L2 - a * a;\n  const h = Math.sqrt(h2 > 0 ? h2 : 0);\n  const mx = ax + (a * vx) / d, my = ay + (a * vy) / d;\n  const bx = mx + (h * vy) / d, by = my - (h * vx) / d;\n  const phi = Math.atan2(by - ay, bx - ax) + alpha;\n  const curX = ax + p * Math.cos(phi);\n  const curY = ay + p * Math.sin(phi);\n  px[s] = curX;\n  py[s] = curY;\n  if (curX < minX) minX = curX;\n  if (curX > maxX) maxX = curX;\n  if (curY < minY) minY = curY;\n  if (curY > maxY) maxY = curY;\n}\n\nconst alturaTotal = maxY - minY;\nif (alturaTotal <= 1e-6) return 800;\nconst diagCaja = Math.hypot(maxX - minX, alturaTotal);\n\nfor (let s = 0; s < N; s++) {\n  const sNext = (s + 1) % N;\n  if (Math.hypot(px[sNext] - px[s], py[sNext] - py[s]) > 0.25 * diagCaja) return 500;\n}\n\n// Fase de apoyo: 35% de pasos inferiores\nconst umbralY = minY + alturaTotal * 0.35;\nlet minYApoyo = Infinity, maxYApoyo = -Infinity, minXApoyo = Infinity, maxXApoyo = -Infinity, sumaYApoyo = 0;\nlet conteoApoyo = 0;\n\nfor (let s = 0; s < N; s++) {\n  const y = py[s];\n  if (y <= umbralY) {\n    conteoApoyo++;\n    const x = px[s];\n    if (y < minYApoyo) minYApoyo = y;\n    if (y > maxYApoyo) maxYApoyo = y;\n    if (x < minXApoyo) minXApoyo = x;\n    if (x > maxXApoyo) maxXApoyo = x;\n    sumaYApoyo += y;\n  }\n}\nif (conteoApoyo === 0) return 800;\nconst anchoApoyo = maxXApoyo - minXApoyo;\nif (anchoApoyo <= 1e-6) return 800;\nconst mediaYApoyo = sumaYApoyo / conteoApoyo;\n\nconst f1 = (maxYApoyo - minYApoyo) / alturaTotal;\nconst f2 = 1 - Math.min(1, anchoApoyo / L_plus_r3);\nconst f3 = Math.max(0, 0.3 - (maxY - mediaYApoyo) / anchoApoyo) / 0.3;\n\nlet sumaDx = 0, sumaAbsDx = 0, nDx = 0;\nfor (let s = 0; s < N; s++) {\n  const sNext = (s + 1) % N;\n  if (py[s] <= umbralY && py[sNext] <= umbralY) {\n    const dX = px[sNext] - px[s];\n    sumaDx += dX;\n    sumaAbsDx += Math.abs(dX);\n    nDx++;\n  }\n}\nlet f4 = 1.0;\nif (nDx >= 3 && sumaAbsDx > 1e-6) {\n  const promDx = sumaDx / nDx;\n  let varDx = 0;\n  for (let s = 0; s < N; s++) {\n    const sNext = (s + 1) % N;\n    if (py[s] <= umbralY && py[sNext] <= umbralY) {\n      const diff = (px[sNext] - px[s]) - promDx;\n      varDx += diff * diff;\n    }\n  }\n  const desvio = Math.sqrt(varDx / nDx);\n  f4 = Math.min(1, desvio / (sumaAbsDx / nDx));\n}\n\nreturn w1 * f1 + w2 * f2 + w3 * f3 + w4 * f4;",
  "grafo": {
    "nodos": [
      {
        "id": "O1",
        "nombre": "O1: Pivote de la manivela",
        "x": 0,
        "y": 0,
        "tipo": "fijo",
        "anguloGuia": 0,
        "masa": 1,
        "carga": 0,
        "cargaElectrica": 0,
        "imanDipolo": 0,
        "temperaturaFuente": 0,
        "variableX": null,
        "variableY": null,
        "variableIman": null,
        "variableCarga": null,
        "variableTemp": null,
        "offsetX": 0,
        "offsetY": 0,
        "escalaX": 1,
        "escalaY": 1
      },
      {
        "id": "O2",
        "nombre": "O2: Pivote del balancín",
        "x": 2,
        "y": 0,
        "tipo": "fijo",
        "anguloGuia": 0,
        "masa": 1,
        "carga": 0,
        "cargaElectrica": 0,
        "imanDipolo": 0,
        "temperaturaFuente": 0,
        "variableX": null,
        "variableY": null,
        "variableIman": null,
        "variableCarga": null,
        "variableTemp": null,
        "offsetX": 0,
        "offsetY": 0,
        "escalaX": 1,
        "escalaY": 1
      },
      {
        "id": "A",
        "nombre": "A: Extremo de la manivela",
        "x": 1,
        "y": 0,
        "tipo": "libre",
        "anguloGuia": 0,
        "masa": 1,
        "carga": 0,
        "cargaElectrica": 0,
        "imanDipolo": 0,
        "temperaturaFuente": 0,
        "variableX": null,
        "variableY": null,
        "variableIman": null,
        "variableCarga": null,
        "variableTemp": null,
        "offsetX": 0,
        "offsetY": 0,
        "escalaX": 1,
        "escalaY": 1
      },
      {
        "id": "B",
        "nombre": "B: Unión acoplador-balancín",
        "x": 2,
        "y": 2,
        "tipo": "libre",
        "anguloGuia": 0,
        "masa": 1,
        "carga": 0,
        "cargaElectrica": 0,
        "imanDipolo": 0,
        "temperaturaFuente": 0,
        "variableX": null,
        "variableY": null,
        "variableIman": null,
        "variableCarga": null,
        "variableTemp": null,
        "offsetX": 0,
        "offsetY": 0,
        "escalaX": 1,
        "escalaY": 1
      }
    ],
    "barras": [
      {
        "id": "acoplador",
        "nombre": "Acoplador L",
        "nodoA": "A",
        "nodoB": "B",
        "longitud": 3.5,
        "variableAsociada": "L",
        "signoTrilateracion": 1,
        "color": "#3b82f6",
        "grosor": 2.5,
        "esAuxiliar": false
      },
      {
        "id": "balancin",
        "nombre": "Balancín r3",
        "nodoA": "B",
        "nodoB": "O2",
        "longitud": 3,
        "variableAsociada": "r3",
        "signoTrilateracion": 1,
        "color": "#3b82f6",
        "grosor": 2.5,
        "esAuxiliar": false
      }
    ],
    "cuerposRigidos": [],
    "motores": [
      {
        "id": "motor_manivela",
        "nombre": "Manivela (radio 1)",
        "tipo": "rotativo",
        "nodoPivote": "O1",
        "nodoExtremo": "A",
        "longitudManivela": 1,
        "velocidadAngular": 1,
        "anguloInicial": 0,
        "carreraMin": 10,
        "carreraMax": 50,
        "variableAsociada": null
      }
    ],
    "transmisiones": [],
    "sensores": [],
    "capasFisicas": []
  }
}
